{
  "schema": "mcrp-agent-task/0.1",
  "synthetic_fixture": true,
  "task_id": "economics_social-bounded-cycle",
  "commands": [
    {
      "id": "offer",
      "action": "offer",
      "agent_id": "author-agent",
      "now": 0,
      "input": {
        "claim_id": "toy-economics_social",
        "claim": "Synthetic sample has2 completions among4 offers; no population causal claim.",
        "evidence": {
          "offered": 4,
          "completed": 2,
          "share": "0.5"
        },
        "scope": [
          "selection-accounting"
        ],
        "dependencies": [],
        "required_groups": 1
      }
    },
    {
      "id": "check",
      "action": "check",
      "agent_id": "review-agent",
      "now": 1,
      "input": {
        "offer": "offer",
        "scope": [
          "selection-accounting"
        ],
        "method": "Caller asserts a manual synthetic fixture check; not executed by this interface",
        "outcome": "support",
        "limits": "Only the disclosed toy calculation; no empirical or institutional validation",
        "units": 1
      }
    },
    {
      "id": "rely",
      "action": "rely",
      "agent_id": "decision-agent",
      "now": 2,
      "input": {
        "offer": "offer",
        "checks": [
          "check"
        ],
        "purpose": "synthetic local demonstration only",
        "scope": [
          "selection-accounting"
        ],
        "kind": "scientific",
        "expires": 20
      }
    },
    {
      "id": "observe-before",
      "action": "observe",
      "agent_id": "decision-agent",
      "now": 2,
      "input": {
        "reliance": "rely",
        "observed_at": 2,
        "max_age": 0
      }
    },
    {
      "id": "amend",
      "action": "amend",
      "agent_id": "author-agent",
      "now": 3,
      "input": {
        "offer": "offer",
        "reason": "One previously omitted offer is disclosed: denominator changes."
      }
    },
    {
      "id": "observe-after",
      "action": "observe",
      "agent_id": "decision-agent",
      "now": 3,
      "input": {
        "reliance": "rely",
        "observed_at": 3,
        "max_age": 0
      }
    },
    {
      "id": "stale-check-refusal",
      "action": "rely",
      "agent_id": "decision-agent",
      "now": 3,
      "input": {
        "offer": "offer",
        "checks": [
          "check"
        ],
        "purpose": "synthetic local demonstration only",
        "scope": [
          "selection-accounting"
        ],
        "kind": "scientific",
        "expires": 20
      }
    },
    {
      "id": "offer-updated",
      "action": "offer",
      "agent_id": "author-agent",
      "now": 4,
      "input": {
        "claim_id": "toy-economics_social",
        "claim": "Synthetic sample has2 completions among5 offers; no population causal claim.",
        "evidence": {
          "offered": 5,
          "completed": 2,
          "share": "0.4"
        },
        "scope": [
          "selection-accounting"
        ],
        "dependencies": [],
        "required_groups": 1
      }
    },
    {
      "id": "recheck",
      "action": "check",
      "agent_id": "review-team-child",
      "now": 5,
      "input": {
        "offer": "offer-updated",
        "scope": [
          "selection-accounting"
        ],
        "method": "Caller asserts a manual synthetic fixture check; not executed by this interface",
        "outcome": "support",
        "limits": "Only the disclosed toy calculation; no empirical or institutional validation",
        "units": 1
      }
    },
    {
      "id": "renew",
      "action": "rely",
      "agent_id": "decision-agent",
      "now": 6,
      "input": {
        "offer": "offer-updated",
        "checks": [
          "recheck"
        ],
        "purpose": "synthetic local demonstration only",
        "scope": [
          "selection-accounting"
        ],
        "kind": "scientific",
        "expires": 20
      }
    },
    {
      "id": "observe-renewed",
      "action": "observe",
      "agent_id": "decision-agent",
      "now": 6,
      "input": {
        "reliance": "renew",
        "observed_at": 6,
        "max_age": 0
      }
    },
    {
      "id": "observe-original",
      "action": "observe",
      "agent_id": "decision-agent",
      "now": 6,
      "input": {
        "reliance": "rely",
        "observed_at": 6,
        "max_age": 0
      }
    }
  ]
}
